{"schema_version":"0.1","commissioning_id":"missing-human","artifact":{"artifact_id":"synth","build_id":"b","verification_id":"v","type":"bot_worker","owner":"SYNTHETIC"},"xdt4":{"verdict":"PASS","evidence_ref":"qc-pass"},"authority":{"authorized":true,"permissions":[],"human_gates":[{"id":"release","required":true,"approved":false}]},"target":{"environment":"test"},"bindings":{"registration_ref":"reg","routing_ref":"route","rule_pack_ref":"rules"},"launch_actions":[{"id":"register","status":"DONE","evidence_ref":"action"}],"evidence":{"activation_ref":"activation","connectivity_ref":"connectivity","routing_ref":"routing"},"blockers":[],"escalations":[],"provenance":{"source_job_id":"XDT5-LAUNCH-BOOTSTRAP-V0-1-001","synthetic":true}}